[
	{
		"uniqueId": "ProcessId",
		"queryPath": "ProcessId.jsonata",
		"inputType": "JsonString",
		"outputType": "JsonString"
	},
	{
		"uniqueId": "processResult",
		"queryPath": "processResult.jsonata",
		"inputType": "JsonString",
		"outputType": "JsonString"
	},
	{
		"uniqueId": "processData",
		"queryPath": "processData.jsonata",
		"inputType": "JsonString",
		"outputType": "JsonString"
	},
	{
		"uniqueId": "processDuration",
		"queryPath": "processDuration.jsonata",
		"inputType": "JsonString",
		"outputType": "JsonString"
	}
]
